{
  "contractVersion": "1.0",
  "modelId": "nudenet-320n",
  "name": "NudeNet 320n",
  "version": "3.4",
  "task": "nsfwDetector",
  "inputs": [
    {
      "name": "images",
      "shape": [
        1,
        3,
        320,
        320
      ],
      "dtype": "float32"
    }
  ],
  "outputs": [
    {
      "name": "output0",
      "shape": [
        1,
        22,
        2100
      ],
      "dtype": "float32"
    }
  ],
  "preprocessing": {
    "kind": "image",
    "resizeWidth": 320,
    "resizeHeight": 320,
    "resizeMode": "letterbox",
    "colorOrder": "RGB",
    "layout": "NCHW",
    "scale": 0.00392156862745098
  },
  "precision": "float32",
  "runtime": "onnxruntime-cpu",
  "batch": 1,
  "file": {
    "path": "data/forge/nudenet/nudenet-320n.onnx",
    "sha256": "eb0ed8d76396e11d1cc7f8e64b1052e9512fa80b6e586ae48dd3d29935299d68",
    "bytes": 12095688
  },
  "sourceUrl": "https://github.com/notAI-tech/NudeNet",
  "licence": "AGPL-3.0 (verify)",
  "notes": "Decoding and NMS in app code (workshop/forge/nudenet/decode.py)."
}
