{
  "contractVersion": "1.0",
  "modelId": "nudenet-640m",
  "name": "NudeNet 640m",
  "version": "3.4",
  "task": "nsfwDetector",
  "inputs": [
    {
      "name": "images",
      "shape": [
        1,
        3,
        640,
        640
      ],
      "dtype": "float32"
    }
  ],
  "outputs": [
    {
      "name": "output0",
      "shape": [
        1,
        22,
        8400
      ],
      "dtype": "float32"
    }
  ],
  "preprocessing": {
    "kind": "image",
    "resizeWidth": 640,
    "resizeHeight": 640,
    "resizeMode": "letterbox",
    "colorOrder": "RGB",
    "layout": "NCHW",
    "scale": 0.00392156862745098
  },
  "precision": "float32",
  "runtime": "onnxruntime-cpu",
  "batch": 1,
  "file": {
    "path": "data/forge/nudenet/nudenet-640m.onnx",
    "sha256": "5d87a1e33da2313faf4fe4d6e3f33b42fb0db74fd130df1cdb845ef0e1654122",
    "bytes": 103473083
  },
  "sourceUrl": "https://github.com/notAI-tech/NudeNet",
  "licence": "AGPL-3.0 (verify)",
  "notes": "Decoding and NMS in app code (workshop/forge/nudenet/decode.py)."
}
