{
  "contractVersion": "1.0",
  "modelId": "nudenet-320n",
  "name": "NudeNet 320n detector",
  "version": "3.4",
  "task": "nsfwDetector",
  "inputs": [
    {
      "name": "images",
      "shape": [
        1,
        3,
        320,
        320
      ],
      "dtype": "float32"
    }
  ],
  "outputs": [
    {
      "name": "output0",
      "shape": [
        1,
        22,
        2100
      ],
      "dtype": "float32"
    }
  ],
  "preprocessing": {
    "kind": "image",
    "resizeWidth": 320,
    "resizeHeight": 320,
    "resizeMode": "letterbox",
    "colorOrder": "RGB",
    "layout": "NCHW",
    "scale": 0.00392156862745098
  },
  "precision": "float16",
  "runtime": "onnxruntime-cpu",
  "batch": 1,
  "file": {
    "path": "models/nudenet-320n.onnx",
    "sha256": "d98d8e1a2ee545edcba7e49ffb863df77ce41817ca2f0b1ce99831d84ba48458",
    "bytes": 12582912
  },
  "sourceUrl": "https://github.com/notAI-tech/NudeNet",
  "licence": "AGPL-3.0"
}
